{
  "feature": "p1-002-provenance-graph-model",
  "stage": "ci-passed",
  "loops": 1,
  "plan_review_verdict": "APPROVE",
  "created": "2026-10-04T10:24:07+08:00",
  "spec_hash": "sha256:fe825daff3d512f4",
  "plan_hash": "sha256:cd4e340307d983eb",
  "tasks_hash": "sha256:f26ba2e7e3506411",
  "updated_at": "2026-10-04T23:17:31+08:00",
  "history": [
    {
      "at": "2026-10-04T10:24:07+08:00",
      "event": "proposed -> specified"
    },
    {
      "at": "2026-10-04T18:03:07+08:00",
      "event": "specified -> planned"
    },
    {
      "at": "2026-10-04T18:11:07+08:00",
      "event": "planned -> tasks-approved"
    },
    {
      "at": "2026-10-04T22:17:51+08:00",
      "event": "ci FAIL"
    },
    {
      "at": "2026-10-04T22:21:01+08:00",
      "event": "ci PASS"
    },
    {
      "at": "2026-10-04T22:26:23+08:00",
      "event": "ci-passed -> implemented"
    },
    {
      "at": "2026-10-04T23:00:06+08:00",
      "event": "loop 1/2 (fail)"
    },
    {
      "at": "2026-10-04T23:05:49+08:00",
      "event": "ci FAIL"
    },
    {
      "at": "2026-10-04T23:17:31+08:00",
      "event": "ci FAIL"
    }
  ],
  "ci_overall": "FAIL"
}
