{
  "feature": "p1-001-reproducible-source-pipeline",
  "stage": "closed",
  "plan_review_verdict": "APPROVE",
  "review_verdict": "APPROVE",
  "spec_hash": "sha256:0d127bb948c6418f",
  "plan_hash": "sha256:709906e8529c58c8",
  "tasks_hash": "sha256:6c9f02b5b0f9d495",
  "loops": 1,
  "created": "2026-10-03T10:20:56+08:00",
  "updated_at": "2026-10-03T18:16:31+08:00",
  "history": [
    {
      "at": "2026-10-03T10:20:56+08:00",
      "event": "proposed -> specified"
    },
    {
      "at": "2026-10-03T10:20:56+08:00",
      "event": "specified -> planned"
    },
    {
      "at": "2026-10-03T10:20:56+08:00",
      "event": "plan-review APPROVE"
    },
    {
      "at": "2026-10-03T10:20:56+08:00",
      "event": "tasks-approved"
    },
    {
      "at": "2026-10-03T13:19:00+08:00",
      "event": "ci FAIL"
    },
    {
      "at": "2026-10-03T13:20:00+08:00",
      "event": "ci FAIL"
    },
    {
      "at": "2026-10-03T13:59:32+08:00",
      "event": "ci FAIL"
    },
    {
      "at": "2026-10-03T14:02:00+08:00",
      "event": "ci FAIL"
    },
    {
      "at": "2026-10-03T14:05:31+08:00",
      "event": "ci FAIL"
    },
    {
      "at": "2026-10-03T14:13:59+08:00",
      "event": "ci FAIL"
    },
    {
      "at": "2026-10-03T14:19:12+08:00",
      "event": "ci FAIL"
    },
    {
      "at": "2026-10-03T14:36:38+08:00",
      "event": "ci PASS"
    },
    {
      "at": "2026-10-03T15:02:38+08:00",
      "event": "reconciled hashes: recorded spec_hash and plan_hash for the plan-review-approved versions; prior values predated F-2..F-9 revisions"
    },
    {
      "at": "2026-10-03T15:03:48+08:00",
      "event": "ci-passed -> implemented"
    },
    {
      "at": "2026-10-03T17:17:12+08:00",
      "event": "ci PASS"
    },
    {
      "at": "2026-10-03T17:32:34+08:00",
      "event": "ci FAIL"
    },
    {
      "at": "2026-10-03T17:35:38+08:00",
      "event": "ci FAIL"
    },
    {
      "at": "2026-10-03T17:38:34+08:00",
      "event": "ci FAIL"
    },
    {
      "at": "2026-10-03T17:40:33+08:00",
      "event": "ci FAIL"
    },
    {
      "at": "2026-10-03T17:42:48+08:00",
      "event": "ci PASS"
    },
    {
      "at": "2026-10-03T18:16:31+08:00",
      "event": "reviewed -> closed"
    },
    {
      "at": "2026-10-03T18:16:31+08:00",
      "event": "loops bumped to 1: second implementation loop resolved review.r1 findings F-1, F-2, F-4..F-11; F-3 deferred by override O-1"
    }
  ],
  "ci_overall": "PASS"
}
